{
  "$schema": "https://json-schema.org/draft/2020-12/schema",
  "$ref": "#/$defs/CreateChatCompletionResponse",
  "$defs": {
    "ChatCompletionMessageCustomToolCall": {
      "type": "object",
      "properties": {
        "id": {
          "type": "string"
        },
        "type": {
          "type": "string",
          "enum": [
            "custom"
          ]
        },
        "custom": {
          "type": "object",
          "properties": {
            "name": {
              "type": "string"
            },
            "input": {
              "type": "string"
            }
          },
          "required": [
            "name",
            "input"
          ]
        }
      },
      "required": [
        "id",
        "type",
        "custom"
      ]
    },
    "ChatCompletionMessageToolCall": {
      "type": "object",
      "properties": {
        "id": {
          "type": "string"
        },
        "type": {
          "type": "string",
          "enum": [
            "function"
          ]
        },
        "function": {
          "type": "object",
          "properties": {
            "name": {
              "type": "string"
            },
            "arguments": {
              "type": "string"
            }
          },
          "required": [
            "name",
            "arguments"
          ]
        }
      },
      "required": [
        "id",
        "type",
        "function"
      ]
    },
    "ChatCompletionMessageToolCalls": {
      "type": "array",
      "items": {
        "oneOf": [
          {
            "$ref": "#/$defs/ChatCompletionMessageToolCall"
          },
          {
            "$ref": "#/$defs/ChatCompletionMessageCustomToolCall"
          }
        ]
      }
    },
    "ChatCompletionModeration": {
      "type": "object",
      "properties": {
        "input": {
          "oneOf": [
            {
              "$ref": "#/$defs/ChatCompletionModerationResults"
            },
            {
              "$ref": "#/$defs/ChatCompletionModerationError"
            }
          ]
        },
        "output": {
          "oneOf": [
            {
              "$ref": "#/$defs/ChatCompletionModerationResults"
            },
            {
              "$ref": "#/$defs/ChatCompletionModerationError"
            }
          ]
        }
      },
      "required": [
        "input",
        "output"
      ]
    },
    "ChatCompletionModerationError": {
      "type": "object",
      "properties": {
        "type": {
          "type": "string",
          "enum": [
            "error"
          ]
        },
        "code": {
          "type": "string"
        },
        "message": {
          "type": "string"
        }
      },
      "required": [
        "type",
        "code",
        "message"
      ]
    },
    "ChatCompletionModerationResults": {
      "type": "object",
      "properties": {
        "type": {
          "type": "string",
          "enum": [
            "moderation_results"
          ]
        },
        "model": {
          "type": "string"
        },
        "results": {
          "type": "array",
          "items": {
            "$ref": "#/$defs/ModerationResultBody"
          }
        }
      },
      "required": [
        "type",
        "model",
        "results"
      ]
    },
    "ChatCompletionResponseMessage": {
      "type": "object",
      "properties": {
        "content": {
          "anyOf": [
            {
              "type": "string"
            },
            {
              "type": "null"
            }
          ]
        },
        "refusal": {
          "anyOf": [
            {
              "type": "string"
            },
            {
              "type": "null"
            }
          ]
        },
        "tool_calls": {
          "anyOf": [
            {
              "$ref": "#/$defs/ChatCompletionMessageToolCalls"
            },
            {
              "type": "null"
            }
          ]
        },
        "annotations": {
          "type": "array",
          "items": {
            "type": "object",
            "required": [
              "type",
              "url_citation"
            ],
            "properties": {
              "type": {
                "type": "string",
                "enum": [
                  "url_citation"
                ]
              },
              "url_citation": {
                "type": "object",
                "required": [
                  "end_index",
                  "start_index",
                  "url",
                  "title"
                ],
                "properties": {
                  "end_index": {
                    "type": "integer"
                  },
                  "start_index": {
                    "type": "integer"
                  },
                  "url": {
                    "type": "string",
                    "format": "uri"
                  },
                  "title": {
                    "type": "string"
                  }
                }
              }
            }
          }
        },
        "role": {
          "type": "string",
          "enum": [
            "assistant"
          ]
        },
        "function_call": {
          "type": [
            "object",
            "null"
          ],
          "deprecated": true,
          "properties": {
            "arguments": {
              "type": "string"
            },
            "name": {
              "type": "string"
            }
          },
          "required": [
            "name",
            "arguments"
          ]
        },
        "audio": {
          "anyOf": [
            {
              "type": "object",
              "required": [
                "id",
                "expires_at",
                "data",
                "transcript"
              ],
              "properties": {
                "id": {
                  "type": "string"
                },
                "expires_at": {
                  "type": "integer",
                  "format": "unixtime"
                },
                "data": {
                  "type": "string"
                },
                "transcript": {
                  "type": "string"
                }
              }
            },
            {
              "type": "null"
            }
          ]
        }
      },
      "required": [
        "role",
        "content"
      ]
    },
    "ChatCompletionTokenLogprob": {
      "type": "object",
      "properties": {
        "token": {
          "type": "string"
        },
        "logprob": {
          "type": "number"
        },
        "bytes": {
          "anyOf": [
            {
              "type": "array",
              "items": {
                "type": "integer"
              }
            },
            {
              "type": "null"
            }
          ]
        },
        "top_logprobs": {
          "type": "array",
          "items": {
            "type": "object",
            "properties": {
              "token": {
                "type": "string"
              },
              "logprob": {
                "type": "number"
              },
              "bytes": {
                "anyOf": [
                  {
                    "type": "array",
                    "items": {
                      "type": "integer"
                    }
                  },
                  {
                    "type": "null"
                  }
                ]
              }
            },
            "required": [
              "token",
              "logprob",
              "bytes"
            ]
          }
        }
      },
      "required": [
        "token",
        "logprob",
        "bytes",
        "top_logprobs"
      ]
    },
    "CompletionUsage": {
      "type": "object",
      "properties": {
        "completion_tokens": {
          "type": "integer",
          "default": 0
        },
        "prompt_tokens": {
          "type": "integer",
          "default": 0
        },
        "total_tokens": {
          "type": "integer",
          "default": 0
        },
        "completion_tokens_details": {
          "type": "object",
          "properties": {
            "accepted_prediction_tokens": {
              "type": "integer",
              "default": 0
            },
            "audio_tokens": {
              "type": "integer",
              "default": 0
            },
            "reasoning_tokens": {
              "type": "integer",
              "default": 0
            },
            "text_tokens": {
              "type": "integer"
            },
            "rejected_prediction_tokens": {
              "type": "integer",
              "default": 0
            }
          }
        },
        "prompt_tokens_details": {
          "type": "object",
          "properties": {
            "audio_tokens": {
              "type": "integer",
              "default": 0
            },
            "cached_tokens": {
              "type": "integer",
              "default": 0
            },
            "text_tokens": {
              "type": "integer"
            },
            "image_tokens": {
              "type": "integer"
            },
            "cache_write_tokens": {
              "type": "integer",
              "default": 0
            }
          }
        }
      },
      "required": [
        "prompt_tokens",
        "completion_tokens",
        "total_tokens"
      ]
    },
    "CreateChatCompletionResponse": {
      "type": "object",
      "properties": {
        "id": {
          "type": "string"
        },
        "choices": {
          "type": "array",
          "items": {
            "type": "object",
            "required": [
              "finish_reason",
              "index",
              "message",
              "logprobs"
            ],
            "properties": {
              "finish_reason": {
                "type": "string",
                "enum": [
                  "stop",
                  "length",
                  "tool_calls",
                  "content_filter",
                  "function_call"
                ]
              },
              "index": {
                "type": "integer"
              },
              "message": {
                "$ref": "#/$defs/ChatCompletionResponseMessage"
              },
              "logprobs": {
                "anyOf": [
                  {
                    "type": "object",
                    "properties": {
                      "content": {
                        "anyOf": [
                          {
                            "type": "array",
                            "items": {
                              "$ref": "#/$defs/ChatCompletionTokenLogprob"
                            }
                          },
                          {
                            "type": "null"
                          }
                        ]
                      },
                      "refusal": {
                        "anyOf": [
                          {
                            "type": "array",
                            "items": {
                              "$ref": "#/$defs/ChatCompletionTokenLogprob"
                            }
                          },
                          {
                            "type": "null"
                          }
                        ]
                      }
                    },
                    "required": [
                      "content",
                      "refusal"
                    ]
                  },
                  {
                    "type": "null"
                  }
                ]
              }
            }
          }
        },
        "created": {
          "type": "integer",
          "format": "unixtime"
        },
        "model": {
          "type": "string"
        },
        "metadata": {
          "$ref": "#/$defs/Metadata"
        },
        "service_tier": {
          "$ref": "#/$defs/ServiceTier"
        },
        "system_fingerprint": {
          "type": "string",
          "deprecated": true
        },
        "object": {
          "type": "string",
          "enum": [
            "chat.completion"
          ]
        },
        "usage": {
          "$ref": "#/$defs/CompletionUsage"
        },
        "moderation": {
          "anyOf": [
            {
              "$ref": "#/$defs/ChatCompletionModeration"
            },
            {
              "type": "null"
            }
          ]
        }
      },
      "required": [
        "choices",
        "created",
        "id",
        "model",
        "object"
      ]
    },
    "Metadata": {
      "anyOf": [
        {
          "type": "object",
          "additionalProperties": {
            "type": "string"
          }
        },
        {
          "type": "null"
        }
      ]
    },
    "ModerationInputType": {
      "type": "string",
      "enum": [
        "text",
        "image"
      ]
    },
    "ModerationResultBody": {
      "properties": {
        "type": {
          "type": "string",
          "enum": [
            "moderation_result"
          ],
          "default": "moderation_result"
        },
        "model": {
          "type": "string"
        },
        "flagged": {
          "type": "boolean"
        },
        "categories": {
          "additionalProperties": {
            "type": "boolean"
          },
          "type": "object"
        },
        "category_scores": {
          "additionalProperties": {
            "type": "number"
          },
          "type": "object"
        },
        "category_applied_input_types": {
          "additionalProperties": {
            "items": {
              "$ref": "#/$defs/ModerationInputType"
            },
            "type": "array"
          },
          "type": "object"
        }
      },
      "type": "object",
      "required": [
        "type",
        "model",
        "flagged",
        "categories",
        "category_scores",
        "category_applied_input_types"
      ]
    },
    "ServiceTier": {
      "anyOf": [
        {
          "type": "string",
          "enum": [
            "auto",
            "default",
            "flex",
            "scale",
            "priority",
            "fast"
          ],
          "default": "auto"
        },
        {
          "type": "null"
        }
      ]
    }
  },
  "x-reference-source": "https://raw.githubusercontent.com/openai/openai-openapi/d156763a484eb247e116e0ea345e16344b0049ba/openapi.json",
  "x-snapshot-date": "2026-10-17"
}
